{
  "$schema": "https://json-schema.org/draft/2020-12/schema",
  "$id": "https://schemas.kujolang.ai/watchdog/telemetry/v2/proposal.json",
  "title": "Watchdog canonical telemetry v2 proposal",
  "description": "Backend-neutral, metadata-first canonical records. This proposal is not the OpenTelemetry wire schema.",
  "type": "object",
  "required": ["schema_version", "batch_id", "producer", "records"],
  "additionalProperties": false,
  "properties": {
    "schema_version": {"const": "watchdog.telemetry.v2"},
    "batch_id": {"type": "string", "minLength": 1, "maxLength": 160},
    "sent_at": {"type": ["string", "null"], "format": "date-time"},
    "producer": {"$ref": "#/$defs/producer"},
    "records": {"type": "array", "minItems": 1, "maxItems": 100, "items": {"$ref": "#/$defs/record"}}
  },
  "$defs": {
    "producer": {
      "type": "object",
      "required": ["name", "version"],
      "additionalProperties": false,
      "properties": {
        "name": {"type": "string", "minLength": 1, "maxLength": 80},
        "version": {"type": "string", "minLength": 1, "maxLength": 40},
        "adapter_id": {"type": ["string", "null"], "maxLength": 80},
        "adapter_version": {"type": ["string", "null"], "maxLength": 40},
        "original_schema": {"type": ["string", "null"], "maxLength": 120}
      }
    },
    "reference": {
      "type": "object",
      "required": ["type", "id"],
      "additionalProperties": false,
      "properties": {
        "type": {"enum": ["session", "run", "turn", "workflow", "task", "agent", "tool_call", "request", "artifact", "evaluation", "external"]},
        "id": {"type": "string", "minLength": 1, "maxLength": 160},
        "relation": {"type": ["string", "null"], "maxLength": 40},
        "namespace": {"type": ["string", "null"], "maxLength": 80}
      }
    },
    "usage": {
      "type": "object",
      "additionalProperties": false,
      "properties": {
        "input_tokens": {"type": ["integer", "null"], "minimum": 0},
        "output_tokens": {"type": ["integer", "null"], "minimum": 0},
        "total_tokens": {"type": ["integer", "null"], "minimum": 0},
        "cached_input_tokens": {"type": ["integer", "null"], "minimum": 0},
        "cache_write_input_tokens": {"type": ["integer", "null"], "minimum": 0},
        "reasoning_tokens": {"type": ["integer", "null"], "minimum": 0},
        "usage_source": {"type": ["string", "null"], "maxLength": 80},
        "total_semantics": {"type": ["string", "null"], "maxLength": 120},
        "provider_usage": {"type": ["object", "null"], "maxProperties": 32, "additionalProperties": {"type": ["string", "number", "integer", "boolean", "null"]}}
      }
    },
    "cost": {
      "type": "object",
      "required": ["kind", "currency", "amount", "source"],
      "additionalProperties": false,
      "properties": {
        "kind": {"enum": ["provider_reported", "catalog_estimated", "subscription_value_estimate", "unknown"]},
        "currency": {"type": "string", "pattern": "^[A-Z]{3}$"},
        "amount": {"type": ["number", "null"], "minimum": 0},
        "source": {"type": "string", "minLength": 1, "maxLength": 120},
        "catalog_version": {"type": ["string", "null"], "maxLength": 80},
        "calculated_at": {"type": ["string", "null"], "format": "date-time"},
        "components": {"type": ["object", "null"], "maxProperties": 16, "additionalProperties": {"type": ["number", "integer", "null"]}}
      }
    },
    "error": {
      "type": ["object", "null"],
      "additionalProperties": false,
      "properties": {
        "class": {"type": ["string", "null"], "maxLength": 120},
        "category": {"type": ["string", "null"], "maxLength": 80},
        "code": {"type": ["string", "null"], "maxLength": 80},
        "retryable": {"type": ["boolean", "null"]},
        "message": {"type": ["string", "null"], "maxLength": 1000}
      }
    },
    "content": {
      "type": "object",
      "required": ["class", "media_type", "value"],
      "additionalProperties": false,
      "properties": {
        "class": {"enum": ["prompt", "response", "tool_input", "tool_output", "retrieval_document", "shell_input", "shell_output", "artifact", "error_detail"]},
        "media_type": {"type": "string", "maxLength": 120},
        "value": {"type": "string", "maxLength": 65536},
        "truncated": {"type": "boolean"}
      }
    },
    "privacy": {
      "type": "object",
      "required": ["content_mode", "policy_version"],
      "additionalProperties": false,
      "properties": {
        "content_mode": {"enum": ["off", "summaries", "selected", "full"]},
        "policy_version": {"type": "string", "maxLength": 80},
        "transformations": {"type": "array", "maxItems": 32, "items": {"type": "string", "maxLength": 80}}
      }
    },
    "record": {
      "type": "object",
      "required": ["record_id", "record_type", "trace_id", "observed_at", "source", "privacy"],
      "additionalProperties": false,
      "properties": {
        "record_id": {"type": "string", "minLength": 1, "maxLength": 160},
        "record_type": {"enum": ["trace", "span", "event"]},
        "trace_id": {"type": "string", "pattern": "^[0-9a-f]{32}$"},
        "span_id": {"type": ["string", "null"], "pattern": "^[0-9a-f]{16}$"},
        "parent_span_id": {"type": ["string", "null"], "pattern": "^[0-9a-f]{16}$"},
        "observed_at": {"type": "string", "format": "date-time"},
        "started_at": {"type": ["string", "null"], "format": "date-time"},
        "ended_at": {"type": ["string", "null"], "format": "date-time"},
        "kind": {"enum": [null, "model", "agent", "tool", "retrieval", "workflow", "handoff", "approval", "execution", "persistence", "evaluation", "internal"]},
        "name": {"type": ["string", "null"], "maxLength": 160},
        "status": {"enum": [null, "unset", "ok", "error", "cancelled", "timeout", "denied"]},
        "source": {"type": "object", "maxProperties": 16, "additionalProperties": {"type": ["string", "number", "integer", "boolean", "null"]}},
        "references": {"type": "array", "maxItems": 24, "items": {"$ref": "#/$defs/reference"}},
        "attributes": {"type": "object", "maxProperties": 128, "additionalProperties": {"type": ["string", "number", "integer", "boolean", "null", "array"]}},
        "usage": {"anyOf": [{"$ref": "#/$defs/usage"}, {"type": "null"}]},
        "costs": {"type": "array", "maxItems": 8, "items": {"$ref": "#/$defs/cost"}},
        "error": {"$ref": "#/$defs/error"},
        "content": {"type": "array", "maxItems": 16, "items": {"$ref": "#/$defs/content"}},
        "privacy": {"$ref": "#/$defs/privacy"}
      },
      "allOf": [
        {"if": {"properties": {"record_type": {"const": "trace"}}}, "then": {"properties": {"span_id": {"type": "null"}, "parent_span_id": {"type": "null"}}}},
        {"if": {"properties": {"record_type": {"const": "span"}}}, "then": {"required": ["span_id"]}}
      ]
    }
  }
}
