{
  "schema_version": "watchdog.telemetry.v2",
  "batch_id": "fixture:model:1",
  "sent_at": "2026-09-01T12:00:01Z",
  "producer": {"name": "fixture-agent", "version": "1.0.0", "adapter_id": "fixture.adapter", "adapter_version": "watchdog.ingestion-adapter.v1", "original_schema": null},
  "records": [
    {
      "record_id": "span:model:1",
      "record_type": "span",
      "trace_id": "0123456789abcdef0123456789abcdef",
      "span_id": "0123456789abcdef",
      "parent_span_id": null,
      "observed_at": "2026-09-01T12:00:01Z",
      "started_at": "2026-09-01T12:00:00Z",
      "ended_at": "2026-09-01T12:00:01Z",
      "kind": "model",
      "name": "chat fixture-model",
      "status": "ok",
      "source": {"producer": "fixture-agent", "adapter_id": "fixture.adapter", "original_schema": "fixture.v1"},
      "references": [{"type": "session", "id": "session-1", "namespace": "fixture", "relation": "groups"}],
      "attributes": {"gen_ai.provider.name": "fixture", "gen_ai.request.model": "fixture-model"},
      "usage": {"input_tokens": 12, "output_tokens": 3, "total_tokens": 15, "cached_input_tokens": 2, "cache_write_input_tokens": null, "reasoning_tokens": 1, "usage_source": "fixture", "total_semantics": "producer_reported", "provider_usage": {"prompt_tokens": 12}},
      "costs": [{"kind": "catalog_estimated", "currency": "USD", "amount": 0.001, "source": "fixture-catalog", "catalog_version": "1", "calculated_at": "2026-09-01T12:00:01Z", "components": null}],
      "error": null,
      "content": [],
      "privacy": {"content_mode": "off", "policy_version": "watchdog.privacy.v1", "transformations": []}
    }
  ]
}
